{
  "schema_version": "0.1",
  "grant_id": "grant.mcp-email-send-001",
  "approval_requirement_ids": [
    "approval.external-email"
  ],
  "binding": {
    "request_id": "request.mcp.99f8630ed8870abf9ce677d3848ddfb1c621a0f26e8584999641433a84009ac9",
    "request_sha256": "0cd2f9f540f378f367074b86e9310d2e92701bb03b8738a881fdf2cb1182db4b",
    "decision_id": "decision.fcccb86310f171d0900fc91ceb66d72dd2e6677d348b178df48bebbf6a33603d",
    "decision_disposition": "require_approval",
    "subject_actor_id": "agent.communicator",
    "capability_id": "capability.email-send",
    "resource_id": "tool.email",
    "parameters_digest": "sha256:44136fa355b3678a1146ad16f7e8649e94fb4fc21fe77e8310c060f61caaff8a",
    "policy": {
      "bundle_id": "bundle.multi-agent-operations",
      "bundle_version": "0.1.0",
      "schema_version": "0.1",
      "source_sha256": "89e3afb072dbddc8e34fe433e5e2b8d208a0210244797e3e579f9a8aaf0b6b77"
    },
    "scope": {
      "allowed_data_classifications": [
        "internal"
      ],
      "max_action_count": 1,
      "max_cost": {
        "amount_minor": 0,
        "currency": "USD"
      },
      "max_delegation_depth": 0,
      "max_duration_seconds": 300,
      "require_reversible": false
    }
  },
  "issued_at": "2026-08-21T20:05:00Z",
  "expires_at": "2026-08-21T20:50:00Z",
  "reuse_policy": "single_use",
  "approvals": [
    {
      "approval_id": "approval.external-email",
      "approver_actor_id": "human.risk-approver",
      "approved_at": "2026-08-21T20:04:00Z",
      "identity": {
        "trust_boundary_id": "identity.reference",
        "assertion_id": "assertion.mcp-risk-approval-001",
        "authenticated_at": "2026-08-21T20:03:00Z",
        "expires_at": "2026-08-21T20:30:00Z"
      },
      "rationale": {
        "code": "risk.reviewed",
        "reference": "ticket:GOV-MCP-100"
      }
    }
  ]
}
